Rubro,Texto
Clothing & Accessories,"QRAFTINK Socks for Women, Girls | Premium Mercerised Cotton Socks for Daily Use & Sports Combo of 5 Liner Socks Qraftink ankle socks in three different colour code pairs. These are made available for you in very vibrant colours after a lot of research. The socks are made of premium mercerised cotton, which is soft and keeps your feet dry and cool at the same time. The socks are designed in a fashion that will give you a great experience. Silicon system is installed in every pair of socks to give you a great hold while you are walking or doing a sporting activity. It is designed keeping in mind the Indian feet. It can stretch upto UK size 10, US size 12 and Euro size 45. There is a well-knitted arch band to keep the socks in place and Y-head to improve the fit. We have put in a great amount of R & D to develop these socks. Our mission is to create a global Yoga and sports brand, originating from India, which delivers nothing but the top quality product. At Curveit, our mission is to always, no matter what, deliver a product of the top most quality. Namaste!"
Clothing & Accessories,"RC. ROYAL CLASS Quarter Length soft cotton multicolored socks for Girls (pack of 5 pairs) RC. ROYAL CLASS Designer pure cotton socks for girls in assorted colors, made from soft cotton yarn and spandex for stretch and elasticity. Very soft cotton socks for kids, for all age groups. Do not Iron or Bleach. Hand wash only. Made in India."
Clothing & Accessories,"Cotson Girl's Cotton Silk Socks Multicolour- Pack Of 5 Lace trim invisible crystal socks make you light and feel cool. Material:90 percent acrylic and 10 percent cotton,elastic,breathable. Size:one size fits all. Length: 7.87inch in bottom length and 3.94-inch in tube length. Quantity: 5 pairs, five different colours as shown in image. Suitable for women, a perfect gift to yourself or friends"
Clothing & Accessories,"QRAFTINK Premium Quality Pack of 6 Skin Ultra-Thin Transparent Nylon Summer Skin Socks for Women/Girl's (Ankle Length red Pink Blue Black Beige) QraftinkWomen's Ultra Thin Transparent Ankle skin Socks are marketed by QRAFTINK to comfortably mould to the natural contours of your leg, but without tight elastication, so avoiding the discomfort caused by constriction rings pressuring sensitive skin. Specification:- These Socks are made from Cotton & Lycra to provide you with Extra Stretch, Light weight and Temperature Regulation. These socks give you unparalleled comfort and are great for healthy feet by absorbing moisture and wicking it away from your skin. Super Quality make it perfect for all day comfort. Features:- Qraftink socks are created to provide a great fit, supreme comfort, and superior performance. They are soft and durable. Socks will provide the perfect finishing touch to any formal or casual look."
Clothing & Accessories,FOOTPRINTS Baby Organic Cotton Socks- BigDot - Pack of 3 Pairs These Footprints socks are Made from pure organic cotton and ecofriendly fibers and colors . They are free from harmful chemicals and coloured dyes which may cause harm to super sensitive skin of your baby. Footprints socks are blended with ecofriendly fiber which does not allow bacteria to grow hence making them antibacterial. Key Features 1. Organic Cotton 2. AntiBacterial 3. Anti Microbial 4. Anti Allergic- No Skin rashes and irratation
Clothing & Accessories,"ISAKAA Baby Socks from Just Born to 8 Years- Pack of 4, 6, 8 and 12 ISAKAA presents Soft and Designer baby socks for your little one's feet,it keeps babies feet warm and comfortable. These regular-socks are light in weight and easy to wear. They are a perfect and elegant fit for babies feet which will provide comfort feel all day long. These socks for your little ones are breathable and comfortable to wear. Attractive color and design gives a stylish look. ISAKAA Baby socks helps to keep your little ones feet protected and warm. Made out of super-fine cotton blend fabric socks are stretchable and machine washable. These cute bunch of fabrics are perfect gift for those little feets. Infants loves to crawl and walk around,these socks will protect the little feet and keep it clean. These socks have a pressure-free sensitive elastic to ensure hold without tightness. Their contrast pretty colors and unique designs on each sock makes them irresistible."
Clothing & Accessories,"RC. ROYAL CLASS Women's Woolen Ankle Length Multicolored Socks (Pack of 5 Pairs) This winter gives your feet a soothing touch with royal class woolen ankle thumb socks for women, made from soft woolen blend yarn and spandex for elasticity. Do not iron or bleach. Hand wash only."
Clothing & Accessories,"QRAFTINK Premium Quality Pack of 5 Skin Ultra-Thin Transparent Nylon Summer Skin Socks for Women/Girl's (Ankle Length) with Thumb QraftinkWomen's Ultra Thin Transparent Ankle skin Socks are marketed by QRAFTINK to comfortably mould to the natural contours of your leg, but without tight elastication, so avoiding the discomfort caused by constriction rings pressuring sensitive skin. Specification:- These Socks are made from Cotton & Lycra to provide you with Extra Stretch, Light weight and Temperature Regulation. These socks give you unparalleled comfort and are great for healthy feet by absorbing moisture and wicking it away from your skin. Super Quality make it perfect for all day comfort. Features:- Qraftink socks are created to provide a great fit, supreme comfort, and superior performance. They are soft and durable. Socks will provide the perfect finishing touch to any formal or casual look."
Clothing & Accessories,"ISAKAA Baby Socks from Just Born to 8 Years- Pack of 4, 6, 8 and 12 ISAKAA presents Soft and Designer baby socks for your little one's feet,it keeps babies feet warm and comfortable. These regular-socks are light in weight and easy to wear. They are a perfect and elegant fit for babies feet which will provide comfort feel all day long. These socks for your little ones are breathable and comfortable to wear. Attractive color and design gives a stylish look. ISAKAA Baby socks helps to keep your little ones feet protected and warm. Made out of super-fine cotton blend fabric socks are stretchable and machine washable. These cute bunch of fabrics are perfect gift for those little feets. Infants loves to crawl and walk around,these socks will protect the little feet and keep it clean. These socks have a pressure-free sensitive elastic to ensure hold without tightness. Their contrast pretty colors and unique designs on each sock makes them irresistible."
Clothing & Accessories,"Supersox Kid's Combed Cotton School Socks Pack of 5 (Black) Crafted from best quality Yarn, these 5 pairs of Kids School Combed Cotton Socks from the house of Supersox are a must-buy! These socks are made of stretch cotton, which will keep you at ease all day long. These socks can be paired with casual as well as formal shoes.Every pair made with care.Finest cotton along with the perfect workmanship.supersox is the standard of ultimate style and comfort."
Clothing & Accessories,FOOTPRINTS Organic cotton Baby Boy Girls Kids Socks-12-30 Months - Pack of 8 Pairs -P3 Stripes & P5 Blue These Footprints socks are Made from pure organic cotton and ecofriendly fibers and colors . They are free from harmful chemicals and coloured dyes which may cause harm to super sensitive skin of your baby. Footprints socks are blended with ecofriendly fiber which does not allow bacteria to grow hence making them antibacterial. Key Features 1. Organic Cotton 2. AntiBacterial 3. Anti Microbial 4. Anti Allergic- No Skin rashes and irratation
Clothing & Accessories,"RC. ROYAL CLASS Ankle Soft Cotton Multicolored Socks for Boys & Girls (pack of 5 pairs) RC. ROYAL CLASS Ankle length designer pure cotton socks for boys and girls in assorted colors, made from soft cotton yarn and spandex for stretch and elasticity. Very soft cotton socks for kids, from age group 1- 20 years. Do not Iron or Bleach. Hand wash only. Made in India. Pack contains 5 designs and 5 different colors(same as shown in product image)."
Clothing & Accessories,"ISAKAA Baby Socks from Just Born to 8 Years- Pack of 4, 6, 8 and 12 ISAKAA presents Soft and Designer baby socks for your little one's feet,it keeps babies feet warm and comfortable. These regular-socks are light in weight and easy to wear. They are a perfect and elegant fit for babies feet which will provide comfort feel all day long. These socks for your little ones are breathable and comfortable to wear. Attractive color and design gives a stylish look. ISAKAA Baby socks helps to keep your little ones feet protected and warm. Made out of super-fine cotton blend fabric socks are stretchable and machine washable. These cute bunch of fabrics are perfect gift for those little feets. Infants loves to crawl and walk around,these socks will protect the little feet and keep it clean. These socks have a pressure-free sensitive elastic to ensure hold without tightness. Their contrast pretty colors and unique designs on each sock makes them irresistible."
Clothing & Accessories,FOOTPRINTS Organic cotton Baby Boy Girls Kids Socks-12-30 Months - Pack of 8 Pairs -P3 Stripes & P5 Blue These Footprints socks are Made from pure organic cotton and ecofriendly fibers and colors . They are free from harmful chemicals and coloured dyes which may cause harm to super sensitive skin of your baby. Footprints socks are blended with ecofriendly fiber which does not allow bacteria to grow hence making them antibacterial. Key Features 1. Organic Cotton 2. AntiBacterial 3. Anti Microbial 4. Anti Allergic- No Skin rashes and irratation
Clothing & Accessories,"Tex Homz Unisex Mercerised Anti-Slip Cotton Loafer Socks (Grey White Blue Black, Free Size) - Pack of 5 Get the no-socks look with these extremely discreet loafer socks from Tex Home. The socks not only help you look good but also enhance the life of your shoes, while keeping your feet clean and fresh."
Clothing & Accessories,"Voberry Voberry Baby-Girl's Socks, Toddlers Lace Bow Knee High Socks Long Soft Cotton Socks Package Content:1Pair Socks"
Clothing & Accessories,"Blinkin Ultra-Thin Black Princess Socks for women/Girl's (Ankle Length) Blinkin Women's Ultra Thin Transparent Crystal lace Ankle skin Socks are marketed by BLINKIN to comfortably mould to the natural contours of your leg, but without tight elastication, so avoiding the discomfort caused by constriction rings pressuring sensitive skin. Specification:- These Socks are made from Cotton & Lycra to provide you with Extra Stretch, Light weight and Temperature Regulation. These socks give you unparalleled comfort and are great for healthy feet by absorbing moisture and wicking it away from your skin. Super Quality make it perfect for all day comfort. Features:- Blinkin socks are created to provide a great fit, supreme comfort, and superior performance. They are soft and durable. Socks will provide the perfect finishing touch to any formal or casual look."
Clothing & Accessories,"RC. ROYAL CLASS Full Length Soft Cotton Unisex Socks - Pack of 5 Pairs RC. ROYAL CLASS pure cotton socks for boys and girls in assorted colors, made from soft cotton yarn and spandex for stretch and elasticity. Very soft cotton socks for kids, from age group 1- 8 years. Do not iron or bleach. Hand wash only."
Clothing & Accessories,"Jockey Women's Cotton Low show socks Jockey International, Inc. is a leading designer, marketer, retailer, and licensor of men’s undergarments and women’s intimates. Jockey is a third generation family-owned company, headquartered between Chicago and Milwaukee in Kenosha, Wisconsin. The company employs over 1,600 associates around the world with operations in Canada, Hong Kong, New York, North Carolina, and Germany. JOCKEY is a registered trademark in over 120 countries."
Clothing & Accessories,"We Bare Bears Kids Cushioned Low Cut socks by Balenzia - Pack of 3 Balenzia, the leading brand of socks in India has launched a quirky collection of We Bare Bears socks. This funky collection is made with finest cotton yarns and highest quality standards ensuring that each sock provides incredible comfort, breathability and durability. Officially licensed product."
Clothing & Accessories,"DADDY G Women's Cotton Knee High Socks (Multicolour, Free Size) - Pack of 2 Black and white knee-high girl's socks. The socks are crafted using finest cotton to please your skin with secure stable fit from toe to knee. They protect and keep your feet and leg clean and safe. You can pair up these socks with shorts, skirts to compliment your look. These multipurpose socks are for school, office and party as it pairs up well with many dresses. Length: 81 cm width:10 cm."
Clothing & Accessories,"Aeoss Women's 3 Pairs Vintage Style Winter Knitting Warm Wool Crew Socks, A-Wave, Free Size Multicolor If you are looking for comfortable and fashion winter socks, these warm wool socks are very suitable for you. Experience ultra-plush warm and comfortable with the perfect jacquard weave vintage socks. These socks feature stylish patterns and vibrant colors that will put a fun finishing touch on your outfits. Perfect for everyday wear. * Womens winter socks made of 35% wool + 29% cotton + 36% polyester, Soft, breathable, wearable, moisture-wicking and odor-fighting. * Our wool socks are free size 23 to 25cm, suitable for women US shoe size 5 to 9, They are elastic and perfectly make it suitable for your feet. * Vintage and trendy design warm socks that will coordinate with whatever you're wearing. Brighten up those cold winter mornings with these snuggly socks to keep your toes warm. * Special design various patterns, full of great fun and joy. Soft and comfortable wool and cotton fabric on your feet, accompany you around every corner, go on a trip with you and living your colorful life."
Clothing & Accessories,"Bonjour Women's Socks (Pack of 4) These extremely comfortable ankle length socks are constructed with Cotton and Lycra, The soft and lightweight cotton blend fabric of these socks offers a comfortable wear, which makes them soft against the skin and high on quality."
Clothing & Accessories,Creature Multicolored Cotton No Show Socks For Women/Girls | Loafer socks For Women/Girls Pack of 4 Pair(SCS-23) These socks are crafted from 100 percent combed cotton and hence will keep your feet comfy and cozy all through the day. Get the Ankle with these extremely discreet Ankle socks from Creature. The socks not only help you look good but also enhance the life of your shoes while keeping your feet clean and fresh.
Clothing & Accessories,"RC. ROYAL CLASS Boys and Girls Calf Length Cotton Elegant Multicolored Socks (Pack of 5 Pairs) Royal Class brings one of the most premium socks for Boys & Girls, made from super soft combed cotton yarn and spandex for elasticity. These socks are designed in such a way to keep your kids warm in winters and cool in summers."
Clothing & Accessories,"Bonjour Girls' Tights Bonjour baby tight keeps your baby’s legs warm in the coldest weather. When the weather is cold outside, this tight prevents small toes and legs from freezing. Made with a mix soft brushed cotton & lycra, treated with a special antimicrobial treatment. These tights offer non bulky , bacteria free warmth. Made from stretchable and breathable fabrics, these can be worn with tees and dresses anytime. Contrast colour with attractive and pretty design make it stylish."
Clothing & Accessories,"Tex Homz Unisex Cotton Anti Slip Cotton Loafers No Show Socks (Multicolour, Free Size) Pack of 6"
Clothing & Accessories,"RC. ROYAL CLASS Women's Ankle Length Double Knit Thumb Cotton Multicolored Socks (Pack of 5 Pairs) Royal Class brings one of the most premium socks for girls made from very soft cotton yarn and spandex for elasticity. Double knit self design socks, one the softest and unique socks available in the market."
Electronics,"Wooky Aqua Stone-10 5W Wireless Waterproof Bluetooth Portable Outdoor Speaker (Black) This Wooky Aqua Stone-10 best wireless portable speaker is designed to port high quality music with you, distortion-free sound wherever you go. Superior sound with detailed design. Equipped with high quality feature and resistance technology. These travel speakers are light in weight, waterproof, shockproof, easily portable, works as a fashion accessory and speaks about your personality whenever you carry it. The underdog with water resistance and shock proofing. Aqua Stone-10 functions smooth in all the terrains and environment. Hassle-free easy connection via Bluetooth and AUX. Commits to be your favourite companion with immersive sound in pool parties, get together, relax time, personal time and home affairs. Wooky promotes the idea of serious audio with affordable fashion forward high end styling for the music lovers who like to plug in powerful audio bolt in their life and plunge into it. Music-on-the-go is what we take ahead with our range of modernized, rugged and designed levelled up audio products - earphones, headphones and speakers. Meant for each age group and gender with a common attribute - love for music in their 'me' time or party time. Note: You need to switch between Bluetooth or AUX modes to connect."
Electronics,"Electronic traders Ahuja Speaker Outdoor/Indoor Srx 50Dx 2-8Inch, 50W A compact general purpose speaker column using two full range dual cone 8"" speakers, reproducing a clean undistorted sound for both speech and music. The system is housed in a rugged closed box enclosure made of 12mm medium density fibre board, and has a durable black shock resistant paint finish. Srx-50dx has nominal impedance of 16w, srx-50xt operates on 100v line with three power taps selectable through a rotary switch."
Electronics,"Ahuja Portable PA system WP-220 with free Max cord brand connector for connecting mobile/PC 1) Wireless PA System WP-220 is perfect for use in Class Rooms, Meetings, Presentations, Wedding Parties, Bus Tours, Outdoor Activities or any application where permanent sound facilities are not available. 2) Built in amplifier with 1 wireless mic, USB/SD player (with recording facility), AUX and Mic inputs. 3) The wireless feature permits easy and hassle-free installation and usage. 4) The compact size of WP-220 allows you to conveniently place it anywhere. 5) Compact, lightweight & easy to carry. 6) Sufficient to cover a gathering of 100 people. 7) Operates on 3 power sources: AC 220-240V, 50/60Hz DC 12-15V Car Battery, 12V 1.2Ah rechargeable battery 8) Can Connect: CD Player, Cassette Recorder, Wired Microphone, PC/Laptop. 9) Distance coverage is around 60 feet approx"
Electronics,"Ahuja Speaker 50Watts Outdoor/Indoor Speaker Srx 50Dx, 2-8Inch Speakers With 2 Meters John Barrel, Weather Resistance Speaker Cable A compact general purpose speaker column using two Full Range Dual Cone 8"" speakers, reproducing a clean undistorted sound for both speech and music. The system is housed in a Rugged Closed Box Enclosure made of 12mm medium density fibre board, and has a durable black shock resistant paint finish. SRX-50DX has nominal impedance of 16W, SRX-50XT operates on 100V line with three power taps selectable through a rotary switch."
Electronics,I KALL IK-001 Bluetooth Single Speaker Portable Indoor Outdoor Wireless/Wired Speaker (Black)
Electronics,"Zoook Rocker M2-Mean Machine 5-in-1 Hi-Fi Bluetooth Speakers Product Description Yet another addition to the Rocker family, inculcating all the core values of Rocker Series to enhance your music listening experience, Rocker Mean Machine is one of the most versatile speakers we at Zoook have ever made! Perfect for indoor and outdoor parties with deep thumping bass like you’ve never heard. Designed to fill the room with rich and crisp sound, the Rocker Mean Machine is packed with a massive 10W 3” Subwoofer that gives you true HD sound quality and it also comes with a shoulder strap so that you can carry your music wherever you go. 				    	 					 From the Manufacturer     Stream Music Wirelessly with Bluetooth Zoook Rocker Mean Machine Portable Bluetooth speaker has A2DP Stereo Bluetooth playback. It connects and wirelessly streams music from any Bluetooth-enabled device such as your mobile phone, notebook, or other portable audio contrivance. The speaker has an immensely colossal 32 foot range that sanctions for maximum mobility. If Bluetooth isn’t an option, the 3.5 mm Aux Jack can be acclimated to plug directly into your Speaker. This way you will always be able to play your favourite music no matter what media device it is on.     Lightweight and Portable Rocker Mean Machine comes in Black colour. The Speaker is only 2.9 pounds making it very lightweight and additionally has a strap that can be annexed for facile portability. The cylindrical shape of the Speaker makes it easy to fit into any backpack or travel bag, perfect for on-the-go music experience.     Perfect Speaker for Any Occasion It has a built-in 3 inch 10 Watt subwoofer which distributes incredible sound and delivers thumping bass that can be facilely packed up and taken anywhere you optate. This makes it the impeccable cull for camping trips, sporting events, tail gaiters or just hanging out in the back yard.      On Board Controls/Ports Micro USB DC 5V  USB port  3.5Aux port  SD card slot  On/Off switch  Mode button  Previous track/Next track  Play/Pause  Volume slider     From ZOOOK, the Choice of Millions of Happy Users  Industry-Leading Technology Worry-Free Warranty 99% Positive Feedback     What’s in the box 1 x Zoook Rocker M2  1 x Shoulder strap 1 x Aux-in cable 1 x Micro usb charging cable 1 x user Manual  1 x TF to SD card adapter 1 x Warranty card"
Electronics,"boAt Stone 260 Portable Bluetooth Speakers (Charcoal Black) Colour:Charcoal Black   BoAt Stone 260 portable Bluetooth speaker can be wirelessly connected to Bluetooth devices such as smartphones, tablets and computers to playback any music collection stored on them. Thanks to its powerful battery, the system delivers powerful sound, separated from any mains supply, for up to 4-5 hours and is the perfect companion for you in the park, or whilst camping or on the beach. What's more? It sports a trendy look and is IPX5 waterproof certified. Process control can get rid of complicated connections and wiring distance constraints, users can enjoy high-quality music. Plug it in plug into Nirvana. Technical Details: Brand :Boat Model :Stone 260 Item Weight :440 g Package Dimensions:14 x 13.8 x 5.8 cm Batteries :1 Lithium ion batteries required. Speaker Connectivity :Wireless Batteries Included :No Batteries Required :No Battery Cell Composition :Lithium Ion"
Electronics,"Ahuja Portable PA system WP-220 with free Max cord brand connector for connecting mobile/PC 1) Wireless PA System WP-220 is perfect for use in Class Rooms, Meetings, Presentations, Wedding Parties, Bus Tours, Outdoor Activities or any application where permanent sound facilities are not available. 2) Built in amplifier with 1 wireless mic, USB/SD player (with recording facility), AUX and Mic inputs. 3) The wireless feature permits easy and hassle-free installation and usage. 4) The compact size of WP-220 allows you to conveniently place it anywhere. 5) Compact, lightweight & easy to carry. 6) Sufficient to cover a gathering of 100 people. 7) Operates on 3 power sources: AC 220-240V, 50/60Hz DC 12-15V Car Battery, 12V 1.2Ah rechargeable battery 8) Can Connect: CD Player, Cassette Recorder, Wired Microphone, PC/Laptop. 9) Distance coverage is around 60 feet approx"
Electronics,"Ahuja Speaker 50Watts Outdoor/Indoor Speaker Srx 50Dx, 2-8Inch Speakers With 2 Meters John Barrel, Weather Resistance Speaker Cable A compact general purpose speaker column using two Full Range Dual Cone 8"" speakers, reproducing a clean undistorted sound for both speech and music. The system is housed in a Rugged Closed Box Enclosure made of 12mm medium density fibre board, and has a durable black shock resistant paint finish. SRX-50DX has nominal impedance of 16W, SRX-50XT operates on 100V line with three power taps selectable through a rotary switch."
Electronics,"boAt Stone 260 Portable Bluetooth Speakers (Charcoal Black) Colour:Charcoal Black   BoAt Stone 260 portable Bluetooth speaker can be wirelessly connected to Bluetooth devices such as smartphones, tablets and computers to playback any music collection stored on them. Thanks to its powerful battery, the system delivers powerful sound, separated from any mains supply, for up to 4-5 hours and is the perfect companion for you in the park, or whilst camping or on the beach. What's more? It sports a trendy look and is IPX5 waterproof certified. Process control can get rid of complicated connections and wiring distance constraints, users can enjoy high-quality music. Plug it in plug into Nirvana. Technical Details: Brand :Boat Model :Stone 260 Item Weight :440 g Package Dimensions:14 x 13.8 x 5.8 cm Batteries :1 Lithium ion batteries required. Speaker Connectivity :Wireless Batteries Included :No Batteries Required :No Battery Cell Composition :Lithium Ion"
