Rubro,Texto
Household,"Sehaz Artworks 'Baby Love' Scrap Book Photo Album (MDF, 30 cm x 21 cm x 3 cm, Brown) Color:BabyLove_A4-ScrapBook   Please Note: The product is a Scrap book, and has black sheets instead of pouch sheets, do not consider it as a classic photo album, it is a scrap book photo album. Material: paper, inside pages High quality black card; Square size: A4 (12x8.5 inch); Inside pages number: 30 pages (Each page can be double-sided use); Capacity: totally depends on your photo size, 5 inch, 6 inch 2/surface, 7 inch 1/surface, 8 -inch1/surface, other abnormal size requires that you own Album use: love log, travel log, baby growth record, family journal, works in this episode, exclusive course, learning materials, and newspapers and magazines in this collection, creative gift; Result Pages: 30 pages; Weight: 0.5 kg."
Household,Sehaz Artworks Home-Side-Shelf-WT-KeyHolder Wooden Key Holder (7 Hooks) Sehaz Artworks Home Side Shelf with Wooden Key Holder. It has 7 hooks and is in brown colour.
Household,"Paper Plane Design Inspirational Posters (Paper, 30.48 cm X 0.65 cm X 45.72 cm, Multicolour, Set of 6, Posters_2018_Design: 66) The only way to finish is to start - we often fear to begin our dream journey because we are apprehensive of the results but we forget that we can reach our goals only if we start acting on them. This unframed quote will serve as a constant reminder that you need to start as soon as possible to make it happen. This powerful quote also serves as a great gift for inspiring someone to begin something new especially if the person is passionate but is apprehensive of the end results. Setting the right spirit is crucial for moving forward in life. We believe that our motivational quotes will fill you and the people around you with energy and excitement. A collection of positive poster designs for modern wall decor, our creations instigate a feeling of enthusiasm and provide a kick-start for the day. The unframed posters give you a simple and smart way of portraying your lifestyle and mood. They provide a classy substitute for paper posters, wall decals and stickers that involve messy sticking and leave untidy marks on the walls. The stylish picture frames are multi-use home and office decoration item that can also be used in hostels and study room, classrooms and corridors as well as shops and cafes. In short, if you can find a wall to nail, these framed posters will stay and convey. From paper plane design. We hope you relish our collection of motivational art prints and quotes. Use these to help focus your thought process and inspire yourself and others towards determination and success. The actual colours may vary slightly due to differences in screen displays."
Household,ESP Creation Friends Paper Poster (Multicolour) This poster comes with portrait mode and are ideal friendship day presents.
Household,"Posterboy 'Chimps' Poster (30.5 cm x 45.7 cm, Multicolor)"
Household,"Paper Plane Design Posters (Paper, 45 cm X 0.5 cm X 30 cm, Multicolour, 117Poster_406) Beautify, inspire, motivate, lighten up, liven up and exhilarate your surroundings with huge and super interesting range of wall posters line up. Quotes for home, office, kitchen, bedroom, dining, dorm room, hostel, on your cupboard or anywhere you like."
Household,"100yellow Paper Buddha Posters, 12x18 Inches (Multicolour)"
Household,"TECHBITE Quotes Posters for Room (Thick Paper, 12x18-inch) Color:1                                                                                 |                            Size:12 x 18 inch   Posters Funny, motivational, inspiring quotes and images. Decorate your bed room or home. 3 Sizes available in HD quality self adhesive with pre installed gumming strips."
Household,"Bikri Kendra Paper Friends Poster(30x45cm, Multicolour) For more attractive POSTER search BIKRIKENDRA. presents good quality paper print poster,decorate your walls with this poster,easy to frame and makes a great gift too,ships quickly and safely in a sturdy protective tube,Decorate and give a classic look to your room with this poster from the house of BIKRIKENDRA. This poster is one of the beautiful things to decorate your room with. Poster is digitally printed on photographic 3 gsm paper resulting in vivid, pure colour and exceptional detail that is suitable for any office, cafes & home. Good Quality. Perfect for Framing. Finding that perfect piece to match your interest and style is easy. This package contains one 18 x 12 inch full colour poster."
Household,"Posterboy 'Warning - No Stupid People' Poster (30.5 cm x 45.7 cm) Humorous Addition to Your Room Display your attitude with the Posterboy Warning - No Stupid People poster. This humorous poster reads 'Warning - No Stupid People Beyond this Point'. It makes a witty addition to a wall, door or entryway. The letters in this humour wall poster are bold and dynamic and are sure to capture the attention of your family and visitors. This poster has a multicoloured backdrop with minimal illustrations. Featuring a simplistic design with bold letters, this wall poster is just what you need to flaunt your sense of humour.Attractive and High-Quality Design The Warning No Stupid People poster is designed in a portrait shape with a prominent border band. It is made of high quality paper and features a matte finish. This multicoloured poster has a length of 45.72cms and a breadth of 30.48cms. It sends out a witty message and is sure to bring a smile on to the face of its readers and cheer them up. You can also display this poster on the door of your bedroom or den to keep people away from entering into your private space without your consent. Brand: Poster Boy Colour: Multicolour Finish: Matte Shape: Portrait Subject: Humour Item Size: 30.48 x 45.72 cm Package Contents: One poster"
Household,"Posterboy 'Murphy's Law' Poster (30.5 cm x 45.7 cm, Multicolor)"
Household,"Bikri Kendra Paper Friends Poster(30x45cm, Multicolour) For more attractive POSTER search BIKRIKENDRA. presents good quality paper print poster,decorate your walls with this poster,easy to frame and makes a great gift too,ships quickly and safely in a sturdy protective tube,Decorate and give a classic look to your room with this poster from the house of BIKRIKENDRA. This poster is one of the beautiful things to decorate your room with. Poster is digitally printed on photographic 3 gsm paper resulting in vivid, pure colour and exceptional detail that is suitable for any office, cafes & home. Good Quality. Perfect for Framing. Finding that perfect piece to match your interest and style is easy. This package contains one 18 x 12 inch full colour poster."
Household,"Paper Plane Design Inspirational Posters (Paper, 30.48 cm X 0.65 cm X 45.72 cm, Multicolour, Set of 6, Posters_2018_Design: 58Single) The only way to finish is to start - we often fear to begin our dream journey because we are apprehensive of the results but we forget that we can reach our goals only if we start acting on them. This unframed quote will serve as a constant reminder that you need to start as soon as possible to make it happen. This powerful quote also serves as a great gift for inspiring someone to begin something new especially if the person is passionate but is apprehensive of the end results. Setting the right spirit is crucial for moving forward in life. We believe that our motivational quotes will fill you and the people around you with energy and excitement. A collection of positive poster designs for modern wall decor, our creations instigate a feeling of enthusiasm and provide a kick-start for the day. The unframed posters give you a simple and smart way of portraying your lifestyle and mood. They provide a classy substitute for paper posters, wall decals and stickers that involve messy sticking and leave untidy marks on the walls. The stylish picture frames are multi-use home and office decoration item that can also be used in hostels and study room, classrooms and corridors as well as shops and cafes. In short, if you can find a wall to nail, these framed posters will stay and convey. From paper plane design. We hope you relish our collection of motivational art prints and quotes. Use these to help focus your thought process and inspire yourself and others towards determination and success. The actual colours may vary slightly due to differences in screen displays."
Household,"AdINFINITUM 300GSM Marvel Superhero Printed Paper Poster, 9x13 Inches(Multicolour, 84) - Set of 8 SHOW YOUR SUPERHERO LOVE. Perfect colors, Creative design, digitally printed high quality 300 gsm paper posters for your home, office. Funny, inspiring and lovable designs to choose from. Make your walls look eye catching and creative with our large collection of posters. WE BELIEVE IN QUALITY AND PROVIDE OUR CUSTOMERS THE SAME"
Household,"Inephos Funny Paper Posters for Room (Pink, 12 x 18- inch)"
Household,"Bikri Kendra Keep Your Chappal and Attitude Paper Poster, 30X45cms, Multicolour For more attractive poster search bikrikendra. Presents quality paper print poster,decorate your walls with this poster,easy to frame and makes a great gift too,ships quickly and safely in a sturdy protective tube,decorate and give a classic look to your room with this poster from the house of bikrikendra. This poster is one of the beautiful things to decorate your room with. Poster is digitally printed on photographic 3gsm paper resulting in vivid, pure colour and exceptional detail that is suitable for any office, cafes & home. Perfect for framing. Finding that perfect piece to match your interest and style is easy and within your budge. This package contains one 18 x 12 inch full colour poster."
Household,"AdINFINITUM Marvel Superhero 300GSM Paper Posters(8x12-inches, Multicolour) - Pack of 5 Show your superhero love. Perfect colors, creative design, digitally printed superior quality 300 gsm paper posters for your home, office. Funny, inspiring and lovable designs to choose from. Make your walls look eye catching and creative with our large collection of posters. We believe in quality and provide our people the same."
Household,"100yellow Inspiring Design Quotes and Messages Paper Poster (Multicolour, 12x18)"
Household,"Bikri Kendra Keep Your Chappal and Attitude Paper Poster, 30X45cms, Multicolour For more attractive poster search bikrikendra. Presents quality paper print poster,decorate your walls with this poster,easy to frame and makes a great gift too,ships quickly and safely in a sturdy protective tube,decorate and give a classic look to your room with this poster from the house of bikrikendra. This poster is one of the beautiful things to decorate your room with. Poster is digitally printed on photographic 3gsm paper resulting in vivid, pure colour and exceptional detail that is suitable for any office, cafes & home. Perfect for framing. Finding that perfect piece to match your interest and style is easy and within your budge. This package contains one 18 x 12 inch full colour poster."
Household,"Party Propz Swirls for Decorations, (Multicolour)"
Household,"Rozi Decoration Happy Birthday Foil Toy Balloon, Blue (Pack of 13 Letters) Color:Blue   Add a little extra shine to your gold birthday decorations with air-filled. These gold foil balloon banners inflate to read ""happy"" and ""b-day."" Mix and match them with other silver letter or number balloons to add to the message. Tape these gold letter balloon banners to the wall or use them as unique photo props. There's no need for helium - just inflate these balloon banners with the included straw for an easy party decoration."
Household,"Theme My Party Latex Metallic HD Balloons (Golden/Silver & Brown_Pack of 50) Color:Golden, Silver & Brown   This Package contains uninflated 50 pcs premium quality metallic HD finish 9"" inch balloons. Great for small and large events decoration. Blow them up with either your mouth, air balloon pump, or helium."
Household,"Theme My Party Latex Metallic HD Balloons (Golden/Silver & Brown_Pack of 50) Color:Golden, Silver & Brown   This Package contains uninflated 50 pcs premium quality metallic HD finish 9"" inch balloons. Great for small and large events decoration. Blow them up with either your mouth, air balloon pump, or helium."
Household,Party Propz Decoration Set Combo (Set of 62) (2 Golden Foil Curtain+50 Gold Metallic Balloon)
Household,"Archana Nhr Decoration Large Balloon Pack Of 100 Pieces (Blue & White) Color:Blue   NHR balloons are beautiful and fun addition to any party. No party would seem complete without balloons to play around with. Balloons are not just for kids parties, they can be used anywhere anytime and for any occasion you wish to celebrate. Whether it is a party in the office, a Christmas bash, a baby shower, wedding, or a casual party for friends, balloons seem to be an essential of party supplies. Along with buntings, balloons are the most favored decorations for any occasion.Grand parties with balloons, you can be sure that your party will always be colorful and fun."
Household,Balaji Art Cotton Wedding Multicolour Umbrella This handcrafted umbrella made up of cotton cloth is essential for the approaching summer season. Prepared by traditional artisans of Jaipur the exclusive elephant print design is decorated with the sparkling beads work on the top of the umbrella.
Household,"Embroiderymaterial Aari Embroidery Needles for Beading and Embroidery Work Purpose (Pack of 4 Needles) These needles are particularly used for doing aari embroidery work with beads, sequins, french wire and thread. These needles have an iron handle which is wrapped with thread to provide a nice grip. This is the festive collection of the needle and would be perfect for doing effortless embroidery work"
Household,"Imported Universal Quilting Embroidery Presser Foot for Sewing Machine Description:- Darning freehand embroidery hopper free motion quilt foot for BROTHER JANOME SINGER This foot can be used for free hand embroidery (like drawing with stitches) and for quilting designs This attachment is an ideal addition to your sewing machine and makes a welcome gift for a keen sewer. Suitable for Butterfly, Brother, Singer, Janome, Juki and other Multifunctional Sewing Machine Please kindly note this does not fit for industrial sewing machine, nor mini sewing machine and some old singer models?974?8019?9032? Material: Steel Color: Silver Package Includes: 1 x Presser Foot Note : Since the size above is measured by hand, the size of the actual item you received could be slightly different from the size above."
Household,"Am Wooden Embroidery Hoop/Frame for Crafters & Designers, Set Of 5-Different Sizes 4, 6, 8, 10, 12 Inches Wooden Embroidery Hoops For Crafting A Number Of Designs. Available In A Variety Of Sizes You Can Select The Shape And Size Of The Embroidery Pattern As Desired."
Household,"Sewn Golden Colour Seed Beads For Embroidery/Superior Quality/Size seed beads used for design dress materials ,like churidhar saree, dhuppatta.and all type of dresses.Also used for art and craft work.it give a speccial attraction for the resses and craft works,its high quality material."
Household,"iCraft RN281 Cotton Embroidery Thread Set (Multicolor, Pack of 100) The set of items include 100 thread of multi-color professional and practical cross stitch and embroidery design and each thread is 8 meters and 26 feet in length. The embroidery thread are made of durable soft polyester cotton material. Must special for cross stitch lovers for embroidery flowers, fruits, animals, natural sceneries, cartoon characters and other art and craft project works. Usage: Don't need machine to use, the best compact sewing kit that is always available, sewing kit easy to access for those quick, on the go repairs great for missing buttons, ripped seams or a quick them make. Care instruction: Keep away from kids."
Household,Embroidery Kit for Beginners DIY Kit Total 15 Iteam This embroidery kit is consists of all the basic items that a beginner will require to learn embroidery. This kit can also be a perfect gift for your loved ones.
Household,"AsianHobbyCrafts Wooden Embroidery Hoop Ring Frame (3 Pieces) Style Name:Assorted A   Asian Hobby Crafts embroidery collection comprises of embroidery frames (in various sizes), cross stitch fabric, embroidery tools, embroidery wool. This embroidery hoop frame is made of well finished wood with a easy-to-adjust screw mounted on the frame to tighten the fabric. Cross stitch art is a phenomenal art form which involves intricate stitching techniques to form beautiful designs on fabric."
Household,"Am Wooden Embroidery Hoop/Frame for Crafters & Designers, Set Of 5-Different Sizes 4, 6, 8, 10, 12 Inches Wooden Embroidery Hoops For Crafting A Number Of Designs. Available In A Variety Of Sizes You Can Select The Shape And Size Of The Embroidery Pattern As Desired."
Household,"Imported Universal Quilting Embroidery Presser Foot for Sewing Machine Description:- Darning freehand embroidery hopper free motion quilt foot for BROTHER JANOME SINGER This foot can be used for free hand embroidery (like drawing with stitches) and for quilting designs This attachment is an ideal addition to your sewing machine and makes a welcome gift for a keen sewer. Suitable for Butterfly, Brother, Singer, Janome, Juki and other Multifunctional Sewing Machine Please kindly note this does not fit for industrial sewing machine, nor mini sewing machine and some old singer models?974?8019?9032? Material: Steel Color: Silver Package Includes: 1 x Presser Foot Note : Since the size above is measured by hand, the size of the actual item you received could be slightly different from the size above."
Household,"Lovely Arts Collection Hand Embroidered Cotton Thread Skeins for Craft Projects, Multicolour (Pack of 25) -LAC97 Package includes 25 skeins, two each of 12 colors. Each skein is 8 yards long. This quality embroidery floss can be used in a multitude of craft projects, including needlecraft, friendship bracelets, stringing beads, and more. Non-toxic."
Household,"Anchor Stranded Cotton Assorted Skeins Stitch Kit, 8m (Fast colour-4624-02222, 50 Skiens, 2 of Each 25 Shades) Anchor stranded cotton is the most popular hand embroidery thread all over the world. A superior 6-strand thread, made from the best egyptian cotton is ideal for all forms of embroidery. Ideal for embroidery, knitting, crotchet & thread art"
Household,"Asian Hobby Crafts Wooden Embroidery Hoop Ring Frame (5 Pieces) Style Name:Assorted B   Asian Hobby Crafts embroidery collection comprises of embroidery frames (in various sizes), cross stitch fabric, embroidery tools, embroidery wool. This embroidery hoop frame is made of well finished wood with a easy-to-adjust screw mounted on the frame to tighten the fabric. Cross stitch art is a phenomenal art form which involves intricate stitching techniques to form beautiful designs on fabric."
Household,"Doodle Stitching Transfer Pack: 300+ Embroidery Patterns About the Author Aimee Ray's work is fresh, bright, sweet and clever, and can be found in numerous publications. She is the bestselling author of Doodle Stitching (9781600590610); Doodle Stitching: The Motif Collection (9781600595813); Doodle Stitching: Embroidery & Beyond (9781454703631) and Doodle Stitching: The Holiday Motif Collection (9781454708599)."
Household,"Voberry Magic Embroidery Pen Punch Needle, Magic Embroidery Pen Set Craft Tool for DIY Threaders Sewing Blue Color Name:Blue    Feature:  100% brand new and high quality   Material: plastic + silica gel  Property: Stocked,  Environmentally Friendly  Size:Approx.13*2cm  There is 1 ~ 2cm error because munual measurement Posted by horizontal.  All product images are in kind, lighting, computer monitor differences result in chromatic aberration with the actual products. the final colors will prevail in kind.   Specifications:a total of three interchangeable needles  1, diameter 1.3mm  2, diameter 1.6mm  3, diameter 2.2mm   Threading Method:  From the middle of a straight tail threading device, thread threading device, threading device taking threading device through the tip aperture from the outside to the inside of penetration, will pass through the line from the tail again through the line, taking the threading device   Package Include:  1*Embroidery Pen  4*Needles"
Household,"AsianHobbyCrafts Wooden Embroidery Hoop Ring Frame (3 Pieces) Style Name:Assorted A   Asian Hobby Crafts embroidery collection comprises of embroidery frames (in various sizes), cross stitch fabric, embroidery tools, embroidery wool. This embroidery hoop frame is made of well finished wood with a easy-to-adjust screw mounted on the frame to tighten the fabric. Cross stitch art is a phenomenal art form which involves intricate stitching techniques to form beautiful designs on fabric."
Household,"Doodle Stitching Transfer Pack: 300+ Embroidery Patterns About the Author Aimee Ray's work is fresh, bright, sweet and clever, and can be found in numerous publications. She is the bestselling author of Doodle Stitching (9781600590610); Doodle Stitching: The Motif Collection (9781600595813); Doodle Stitching: Embroidery & Beyond (9781454703631) and Doodle Stitching: The Holiday Motif Collection (9781454708599)."
Household,"Sewn Golden Colour Seed Beads For Embroidery/Superior Quality/Size seed beads used for design dress materials ,like churidhar saree, dhuppatta.and all type of dresses.Also used for art and craft work.it give a speccial attraction for the resses and craft works,its high quality material."
Household,"Embroiderymaterial Aari Embroidery Needles for Beading and Embroidery Work Purpose (Pack of 4 Needles) These needles are particularly used for doing aari embroidery work with beads, sequins, french wire and thread. These needles have an iron handle which is wrapped with thread to provide a nice grip. This is the festive collection of the needle and would be perfect for doing effortless embroidery work"
Household,"Segolike Pack of 100 3RL Disposable Professional Tattoo Needels Microblading Eyebrow Embroidery Needles for Body Art Design Description: - Individually packed, disposable, for single use only. - Made of high quality metal can make the tatto pattern more beautiful. - You can choose assorted Tattoo Needles. - Tatto needles also suit for liner and shader. - Needles are sharp and elastic, make the eyebrow line natural. Specification: - Material: Metal - Color: Silver Package Includes: 100 Pieces tattoo needles"
Household,"Asian Hobby Crafts Wooden Embroidery Hoop Ring Frame (5 Pieces) Style Name:Assorted B   Asian Hobby Crafts embroidery collection comprises of embroidery frames (in various sizes), cross stitch fabric, embroidery tools, embroidery wool. This embroidery hoop frame is made of well finished wood with a easy-to-adjust screw mounted on the frame to tighten the fabric. Cross stitch art is a phenomenal art form which involves intricate stitching techniques to form beautiful designs on fabric."
Household,"Lovely Arts Collection Hand Embroidered Cotton Thread Skeins for Craft Projects, Multicolour (Pack of 25) -LAC97 Package includes 25 skeins, two each of 12 colors. Each skein is 8 yards long. This quality embroidery floss can be used in a multitude of craft projects, including needlecraft, friendship bracelets, stringing beads, and more. Non-toxic."
Household,"Voberry Magic Embroidery Pen Punch Needle, Magic Embroidery Pen Set Craft Tool for DIY Threaders Sewing Blue Color Name:Blue    Feature:  100% brand new and high quality   Material: plastic + silica gel  Property: Stocked,  Environmentally Friendly  Size:Approx.13*2cm  There is 1 ~ 2cm error because munual measurement Posted by horizontal.  All product images are in kind, lighting, computer monitor differences result in chromatic aberration with the actual products. the final colors will prevail in kind.   Specifications:a total of three interchangeable needles  1, diameter 1.3mm  2, diameter 1.6mm  3, diameter 2.2mm   Threading Method:  From the middle of a straight tail threading device, thread threading device, threading device taking threading device through the tip aperture from the outside to the inside of penetration, will pass through the line from the tail again through the line, taking the threading device   Package Include:  1*Embroidery Pen  4*Needles"
Household,"iCraft RN281 Cotton Embroidery Thread Set (Multicolor, Pack of 100) The set of items include 100 thread of multi-color professional and practical cross stitch and embroidery design and each thread is 8 meters and 26 feet in length. The embroidery thread are made of durable soft polyester cotton material. Must special for cross stitch lovers for embroidery flowers, fruits, animals, natural sceneries, cartoon characters and other art and craft project works. Usage: Don't need machine to use, the best compact sewing kit that is always available, sewing kit easy to access for those quick, on the go repairs great for missing buttons, ripped seams or a quick them make. Care instruction: Keep away from kids."
Household,"Anchor Stranded Cotton Assorted Skeins Stitch Kit, 8m (Fast colour-4624-02222, 50 Skiens, 2 of Each 25 Shades) Anchor stranded cotton is the most popular hand embroidery thread all over the world. A superior 6-strand thread, made from the best egyptian cotton is ideal for all forms of embroidery. Ideal for embroidery, knitting, crotchet & thread art"
Household,YD Designs Embroidery Thread Shade Card for Designers (Design 1) Style:Design 1   Embroidery thread yarns shade card which is available in multicolour .
