Rubro,Texto
Books,"Endure: Mind, Body and the Curiously Elastic Limits of Human Performance Review ‘This book is AMAZING!’ ― MALCOLM GLADWELL‘If you want to gain insight into the mind of great athletes, adventurers, and peak performers then prepare to be enthralled by Alex Hutchinson’s Endure.’ –BEAR GRYLLS‘Anyone who has ever felt exhausted, whether from heat or cold or altitude or pain or simply a loss of will, is going to find their own experience in this book.” ― DAVID EPSTEIN, author of The Sports GeneAn essential read for every endurance athlete.” ― AMBY BURFOOT, 1968 Boston Marathon winner and editor of Runner's World Complete Book of Running‘This is an excellent resource for anyone seeking to better to understand how our minds influence our ultimate performances.’ ― TIM NOAKES, emeritus professor of exercise science at the University of Cape Town‘An intelligent, exhaustively researched study.’ – The Times About the Author Alex Hutchinson is a contributing editor at popular mechanics magazine, senior editor at Canadian running magazine and columnist for the Toronto globe and mail. He holds a master's in journalism from Columbia and a Ph.D. In physics from Cambridge and he did his postdoctoral research with the U. S. National security agency."
Books,"21 Lessons for the 21st Century Review “The human mind wants to worry. This is not necessarily a bad thing—after all, if a bear is stalking you, worrying about it may well save your life. Although most of us don’t need to lose too much sleep over bears these days, modern life does present plenty of other reasons for concern: terrorism, climate change, the rise of A.I., encroachments on our privacy, even the apparent decline of international cooperation. In his fascinating new book, 21 Lessons for the 21st Century, the historian Yuval Noah Harari creates a useful framework for confronting these fears. While his previous best sellers, Sapiens and Homo Deus, covered the past and future respectively, his new book is all about the present. The trick for putting an end to our anxieties, he suggests, is not to stop worrying. It’s to know which things to worry about, and how much to worry about them. . . . Harari is such a stimulating writer that even when I disagreed, I wanted to keep reading and thinking. . . . [Harari] has teed up a crucial global conversation about how to take on the problems of the twenty-first century.”—Bill Gates, The New York Times Book Review“If there were such a thing as a required instruction manual for politicians and thought leaders, Israeli historian Yuval Noah Harari’s 21 Lessons for the 21st Century would deserve serious consideration. In this collection of provocative essays, Harari, author of the critically praised Sapiens and Homo Deus, tackles a daunting array of issues, endeavoring to answer a persistent question: ‘What is happening in the world today, and what is the deep meaning of these events?’ . . . Harari makes a passionate argument for reshaping our educational systems and replacing our current emphasis on quickly outdated substantive knowledge with the ‘four Cs’—critical thinking, communication, collaboration and creativity. . . . Thoughtful readers will find 21 Lessons for the 21st Century to be a mind-expanding experience.”—BookPage (top pick) “A sobering and tough-minded perspective on bewildering new vistas.”—Booklist (starred review)  “Magnificently combining historical, scientific, political, and philosophical perspectives, Harari . . . explores twenty-one of what he considers to be today’s ‘greatest challenges.’ Despite the title’s reference to ‘lessons,’ his tone is not prescriptive but exploratory, seeking to provoke debate without offering definitive solutions. . . . Within this broad construct, Harari discusses many pressing issues, including problems associated with liberal democracy, nationalism, immigration, and religion. This well-informed and searching book is one to be savored and widely discussed.”—Publishers Weekly (starred review) “A highly instructive exploration of ‘current affairs and . . . the immediate future of human societies.’ Having produced an international bestseller about human origins and avoided the sophomore jinx writing about our destiny, Harari proves that he has not lost his touch, casting a brilliantly insightful eye on today’s myriad crises, from Trump to terrorism, Brexit to big data. . . . [In] twenty-one painfully astute essays, he delivers his take on where our increasingly ‘post-truth’ world is headed. Human ingenuity, which enables us to control the outside world, may soon re-engineer our insides, extend life, and guide our thoughts. Science-fiction movies get the future wrong, if only because they have happy endings. Most readers will find Harari’s narrative deliciously reasonable, including his explanation of the stories (not actually true but rational) of those who elect dictators, populists, and nationalists. His remedies for wildly disruptive technology (biotech, infotech) and its consequences (climate change, mass unemployment) ring true, provided nations act with more good sense than they have shown throughout history. Harari delivers yet another tour de force.”—Kirkus Reviews (starred review)  About the Author Yuval Noah Harari has a Ph.D. in history from the University of Oxford, and now lectures at the Hebrew University of Jerusalem, specializing in world history. His two books, Sapiens: A Brief History of Humankind and Homo Deus: A Brief History of Tomorrow, have become global best­sellers, with more than twelve million copies sold and translations in more than forty-five languages. 				    	 					              See all Product description"
Books,The Power of Now: Unabridged: A Guide to Spiritual Enlightenment 
Books,Think And Grow Rich SELF HELP BOOK BY NAPOLEON HILL.
Books,"Endure: Mind, Body, and the Curiously Elastic Limits of Human Performance About the Author Alex Hutchinson, Ph.D., is a columnist for Outside magazine and was a long-time columnist for Runner's World. A National Magazine Award winner, he is a regular contributor to The New Yorker online, pens the weekly Jockology column in the Toronto Globe and Mail, and writes for the New York Times. FiveThirtyEight recently named him one of their favorite running science geeks. He was a two-time finalist in the 1,500 meters at the Canadian Olympic Trials, and represented Canada internationally in track, cross-country, road racing, and mountain running competitions. He holds a Ph.D. in physics from the University of Cambridge, and has worked as a researcher for the U.S. National Security Agency. He lives in Toronto, Canada."
Books,"The Heartfulness Way: Heart-Based Meditations for Spiritual Transformation Review This book is excellent for spiritual seeker s in current time, it is engaging and filled with philosophies of life that you can connect with yourself. --By Rahul on 18 January 2018How many books when you read you FEEL that it should never finish, just go on and on and on. This is one of those books. Whatever you want to ask some1 related to life and meditation just think that question in mind and it will be answered here ! Very subtle and deep book. --By Amazon customer on 19 January 2018A must read guide to the Heartfulness way and how it can change our day-to-day lives. The author has done an excellent job of capturing the essence of Heartfulness approach and its transformative potential through a series of easy to understand candid conversations with Daaji. Heartfulness proposes a balanced, integrated existence, where life's spiritual and material aspects can harmoniously coexist. Its is an invitation to experience the simple practice that has transformed my life and of many others practicing the Heartfulness Way around the world. Its easily adopted practices are appropriate for people from all walks of life, cultures, religious beliefs and economic status over the age of 15. Give it a try and let your heart guide you. --By Vijay on 20 January 2018 				    	 					 About the Author Kamlesh D. Patel is an original voice in an ancient tradition. Known widely as Daaji, his teachings arise from his personal experience on the path of Heartfulness, while reflecting his deep spirit of enquiry and respect for the world’s great spiritual traditions and scientific advancements. Daaji practised pharmacy in New York City for over three decades before being named as the successor in a century-old lineage of spiritual masters. Fulfilling the many duties of a modern-day guru, he travels widely, extending his support to spiritual seekers everywhere. A self-professed student of spirituality, he devotes much of his time and energy to research in the field of consciousness and spirituality, approaching the subject with scientific methodology—a practical approach that stems from his own experience and mastery in the field. Joshua Pollock is a Heartfulness trainer and practitioner from the United States. An accomplished Western classical violinist, he has performed and taught throughout the world, and his violin solos can be heard in numerous A.R. Rahman original soundtracks such as Ghajini, Delhi 6, Raavan, Yuvvraaj, Blue, Vinnaithaandi Varuvaayaa and Raavanan. A dedicated spiritual aspirant, Joshua is enthusiastic about sharing his passion for meditation, frequently lecturing at private seminars, holding practical demonstrations in corporate, educational and governmental settings, and providing ongoing individual support to local seekers. Joshua holds a Bachelor of Musical Arts degree from Indiana University and two master’s degrees from the Guildhall School of Music and Drama in London. He currently resides in India with his wife and their two children."
Books,"21 Lessons for the 21st Century Review ""Fascinating… compelling… [Harari] has teed up a crucial global conversation about how to take on the problems of the 21st century."" (Bill Gates New York Times)""The great thinker of our age."" (The Times)""Truly mind-expanding… Ultra-topical… Harari’s big selling point [is] the ambition and breadth of his work, smashing together unexpected ideas into dazzling observations."" (Guardian)""Erudite, illuminating, vivid. [Harari’s] lessons suggest new ways of thinking about current problems… a splendid, sobering, stirring call to arms."" (Sunday Times)""There is surely no one alive who is better at explaining our world than Yuval Noah Harari - he is the lecturer we all wish we’d had at university. Reading this book, I must have interrupted my partner a hundred times to pass on fascinating things I’d just read. Harari has done it again - 21 Lessons is, simply put, a crucial book."" (Adam Kay)""More comprehensible [than Sapiens and Homo Deus]... showing you things you thought you knew about in a completely new way… I find Harari’s writing exhilarating."" (Radio Times)""Harari thrills his readers because he addresses the biggest possible topics with confidence and brio. Compared with the subjects he tackles, anything else we might read looks piffling and parochial."" (Evening Standard)""Harari’s genius at weaving together insights from different disciplines, ranging from ancient history to neuroscience to philosophy to artificial intelligence, has enabled him to respond to the clamour to understand where we have come from and where we might be heading… 21 Lessons is lit up by flashes of intellectual adventure and literary verve."" (Financial Times)""Written in the author’s trademark lucid prose, the book makes difficult concept comprehensible, and is very much a work for our times… 21 Lessons absorbs from start to finish."" (Ian Thomson Tablet)""A terrific primer on where we are now and where we might be heading… Harari is a superb global cartographer, and 21 Lessons for the 21st Century is a lucid and essential read."" (Marina Vaizey Arts Desk) 				    	 					 About the Author Yuval Noah Harari has a PhD in History from the University of Oxford and now lectures at the Hebrew University of Jerusalem, specialising in world history. His two books, Sapiens: A Brief History of Humankind and Homo Deus: A Brief History of Tomorrow, have become global bestsellers, with more than 12 million copies sold, and translations in more than forty-five languages."
Books,"Autobiography of a Yogi (Complete Paperback Edition) Amazon.com Review ""I keep stacks of Autobiography of a Yogi around the house, and I give it out constantly to people. When people need 'regrooving,' I say read this, because it cuts to the heart of every religion."" - George Harrison 				    	 					 About the Author About the Author: Paramahamsa Yogananda was an Indian spiritual Guru who introduced westerners to Kriya Yoga. He began his spiritual journey very early in life and has shared his wisdom with the world through his speeches as well as his books. After spending years in the U.S.A teaching yoga and meditation, Paramahamsa Yogananda took a Mahasamadhi in the year 1952 at the age of 59. His other works include Metaphysical Meditations, Man's Eternal Quest, Scientific Healing Affirmations, Law of Success, How You Can Talk With God and The Bhagavad Gita: God Talks With Arjuna."
Books,"Life's Amazing Secrets: How to Find Balance and Purpose in Your Life About the Author Gaur Gopal Das studied electrical engineering from the College of Engineering, Pune. After a brief stint with Hewlett Packard, he decided to live life as a monk in an ashram in downtown Mumbai. He has remained there for twenty-two years, learning the antiquity of ancient philosophy and the modernity of contemporary psychology, to become a life coach to thousands in the city. Gaur Gopal Das has been travelling the world since 2005, sharing his wisdom with corporate executives, universities and charities. In 2016, his global popularity exploded as he took his message online. With millions of views on his videos on social media, he has now begun to lead a movement to help others achieve happiness and purpose in their lives. Now one of the most famous monks in the world, Gaur Gopal Das holds the title of 'The Ideal Young Spiritual Guru', conferred upon him by the Indian Student Parliament, MIT Pune."
Books,"The Secret About the Author Rhonda Byrne is the creator behind The Secret, a documentary film that swept the world in 2006, changing millions of lives and igniting a global movement. Later that same year, Rhonda’s book of The Secret was released. It has been translated into more than fifty languages and remains one of the longest-running bestsellers of this century. Rhonda has written three more bestselling books: The Power in 2010, The Magic in 2012, and Hero in 2013. 				    	 					 From AudioFile Audio seems like the natural medium for Rhonda Byrne's blockbuster motivational book on positive thought for positive results. The Australian TV producer leads listeners through her exposition on the secret of life. Quoting from an array of New Age gurus and interpreting more traditional teachers as well, the program integrates sound bites from the various authors, with actors taking many of the roles. Neale Donald Walsh, Denis Waitley, Jack Canfield, and dozens of others make cameo comments throughout the program. Byrne's slightly whispery, intimate voice calling the listener to believe alternates with hyped ""you-can-do-it"" encouragement from speakers like Bob Proctor. Kudos goes to the production team that integrated the dozens of speakers--some just introducing who will speak next. The resulting audio keeps a rapid pace hop-skipping along to support Byrne's premise of the essential ""Law of Attraction."" R.F.W. © AudioFile 2007, Portland, Maine-- Copyright © AudioFile, Portland, Maine"
Books,"The 5 AM Club: Own Your Morning, Elevate Your Life Review A book that could change your life!!!! This is the best book i have read in my life!!!!! This is one book that could change your life forever. It could be your doorway to new realms of happiness, peace, prosperity in your life. Also please consider gifting this book to your near and dear ones (this would indirectly contribute to fighting battle against leprosy) --By Sundeep on 19 December 2018 				    	 					 Review “Robin Sharma’s books are helping people all over the world lead great lives.”  —PAULO COELHO 				    	 					              See all Product description"
Books,"Ageless Body, Timeless Mind: The Quantum Alternative to Growing Old (Deepak Chopra) From the Inside Flap 2 cassettes / 3 hoursRead by the Author, Deepak ChopraThe #1 National BestsellerDr. Deepak Chopra, bestselling author of The Path to Love and The Way of the Wizard, reveals our own extraordinary power to reverse the effects of aging and this remarkable AudioBook with musical accompaniment by George Harrison. 				    	 					 About the Author Deepak Chopra, educational director of The Chopra Center For Well Being in La Jolla, California, is a pioneer in helping individuals maximize their ability to achieve success and fulfillment through mind body techniques. A best-selling author of both nonfiction and fiction and a leading, internationally recognized motivational speaker, Dr. Chopra is expanding the concept of good health and self-knowledge through a blending of Western medicine with the ancient techniques of Ayurvedic health care. The basic tenet of Ayurveda is that one's physical health is the balanced integration of body, mind, and spirit.Also available from Random House Audio and Deepa Chopra:Boundless EnergyCreating HeathThe Deepak Chopra Wellness CollectionHealing the HeartJourney Into HealingOvercoming AddictionsThe Path to LovePerfect DigestionPerfect WeightRestful SleepThe Return to Merlin (Fiction)The Seven Spiritual Laws for ParentsThe Way of the Wizard 				    	 					              See all Product description"
Books,"Yoga Mind and Body (Dk Living) Review Inspirational...can't fail to give confidence to absolute beginners and encouragement to more advanced students. (Practical Health) 				    	 					 About the Author The International Sivananda Yoga Vedanta Centre is a non-profit organisation founded by renowned authority on Hatha Yoga and Raja Yoga, Swami Vishnu-devananda in 1957. By closely observing the lifestyles and needs of people in the West, Swami synthesised the ancient wisdom of yoga into five basic principles that could easily be incorporated into one’s own lifestyle to provide the foundation for healthy living. It is around these five principles that the activities at the Sivananda Yoga Vedanta Centres are based. They include: Exercise, Breathing, Relaxation, Diet and Positive Thinking and Meditation."
Books,"Life's Amazing Secrets: How to Find Balance and Purpose in Your Life About the Author Gaur Gopal Das studied electrical engineering from the College of Engineering, Pune. After a brief stint with Hewlett Packard, he decided to live life as a monk in an ashram in downtown Mumbai. He has remained there for twenty-two years, learning the antiquity of ancient philosophy and the modernity of contemporary psychology, to become a life coach to thousands in the city. Gaur Gopal Das has been travelling the world since 2005, sharing his wisdom with corporate executives, universities and charities. In 2016, his global popularity exploded as he took his message online. With millions of views on his videos on social media, he has now begun to lead a movement to help others achieve happiness and purpose in their lives. Now one of the most famous monks in the world, Gaur Gopal Das holds the title of 'The Ideal Young Spiritual Guru', conferred upon him by the Indian Student Parliament, MIT Pune."
Books,"The Power of your Subconscious Mind Review It is an awesome book... psychological aspects of mind is expressed in an understandable manner. --ByRenjith Ravindranon 24 May 2017Must buy for everyone. Amazing book. I have just started reading it and completed first 2 chapters but. But i am highly immpressed with the example given in it and going to finish in next 3 days. --By A customer on 16 December 2015It's a very good n very useful book n it should be read by each n every one ...to knw the things that are not aware and know about the mind power .. Super duper book --ByAmazon Customeron 19 March 2017 				    	 					 About the Author Joseph Murphy was an American author and New Thought minister, ordained in Divine Science and Religious Science."
Books,"Monk Who Sold His Ferrari From the Back Cover Wisdom to Create a Life of Passion, Purpose, and PeaceThis inspiring tale provides a step-by-step approach to living with greater courage, balance, abundance, and joy. A wonderfully crafted fable, The Monk Who Sold His Ferrari tells the extraordinary story of Julian Mantle, a lawyer forced to confront the spiritual crisis of his out-of-balance life. On a life-changing odyssey to an ancient culture, he discovers powerful, wise, and practical lessons that teach us to:  Develop Joyful Thoughts,  Follow Our Life's Mission and Calling,  Cultivate Self-Discipline and Act Courageously,  Value Time as Our Most Important Commodity,  Nourish Our Relationships, and  Live Fully, One Day at a Time. About the Author ROBIN SHARMA is a globally respected humanitarian. Widely considered one of the world’s top leadership and personal optimization advisors, his clients include famed billionaires, professional sports superstars and many Fortune 100 companies. The author’s #1 bestsellers such as The Monk Who Sold His Ferrari, The Greatness Guide and The Leader Who Had No Title, are in over 92 languages making him one of the most broadly read writers alive today."
Books,"Think and Grow Rich (Think and Grow Rich (Audio)) About the Author Napoleon Hill (1883-1970) was born in a one-room cabin on the Pound River in Wise County, Virginia. He began his writing career at age 13 as a ""mountain reporter"" for small town newspapers and went on to become America's most beloved motivational author. His classic work, Think and Grow Rich, continues to inspire millions to believe and achieve and is a cornerstone of the modern self-actualization movement. Before passing, Hill established the Foundation as a nonprofit educational institution whose mission is to perpetuate his philosophy of leadership, self-motivation, and individual achievement."
Books,"Think & Grow Rich About the Author NAPOLEON HILL, born in Pound, Southwest Virginia in 1883, was a very successful American author in the area of the new thought movement—one of the earliest producers of the modern genre of personal-success literature. He is widely considered to be one of the great writers on success. The turning point in Hill’s life occurred in the year 1908 when he interviewed the industrialist Andrew Carnegie—one of the most powerful men in the world at that time, as part of an assignment—an interview which ultimately led to the publication of Think and Grow Rich, one of his best-selling books of all time. the book examines the power of personal beliefs and the role they play in personal success. Hill, who had even served as the advisor to President Franklin D. Roosevelt from 1933-36, passed away at the age of 87."
Books,"Principles of Mind-Body Medicine Principles of Mind-Body Medicine provides an introduction to the scientific underpinnings of mind-body medicine. The past few decades have witnessed an explosion of information in this field, revealing the intertwined nature of physical and mental processes. A firm understanding of the neurobiological basis of these links is needed to leverage the theory of mind-body medicine into clinical practice."
Books,"The Secret About the Author Rhonda Byrne is the creator behind The Secret, a documentary film that swept the world in 2006, changing millions of lives and igniting a global movement. Later that same year, Rhonda’s book of The Secret was released. It has been translated into more than fifty languages and remains one of the longest-running bestsellers of this century. Rhonda has written three more bestselling books: The Power in 2010, The Magic in 2012 and Hero in 2013."
Books,"Ageless Body, Timeless Mind 10th Anniversary Edition: A Practical Alternative To Growing Old Book Description 10th anniversary edition of the worldwide bestseller that reveals the alternative to growing old and the key to lasting health 				    	 					 About the Author Deepak Chopra is the author of more than fifty books translated into over thirty-five languages, including numerous New York Times bestsellers in both fiction and nonfiction. Visit him at www.DeepakChopra.com."
