Rubro,Texto
Household,"Sky Trends Plastic Basket with Artificial Flower and Plant (Violet and Multicolour, 22x10x12cm) A fantastic gift to say you care, for a Birthday present or Anniversary gift, a special gift that will create a talking point.This eye catching decorative miniature rickshaw fabricated Vase with high quality materials. It is replica of the original rickshaw.These beautiful vase from the house of Sky Trends that will instantly enhance the visual appeal of your room.This is crafted by skilled craftsmen and it is designed for providing elegant and traditional look for home decor."
Household,"Aashi Enterprise Cane Basket roti Serving Gift Multipurpose Flower Fruit Vegetable (38 cm x 38 cm x 41 cm, Brown) This handcrafted basket from the house of Aashi Enterprise is best for seasonal decorations and to make home look more attractive and give a ancient look. These handcrafted products are made of cane and it comes in brown color weighing 0.5 kg and with this dimension 38 cm x 38 cm x 41 cm ."
Household,Pragati Pro flower basket diary Pragati Pro flower basket diary
Household,"Imported White Satin Bowknot Wedding Flower Girl Basket Faux Pearl Rhinestone Decor Description: White flowergirl basket with faux pearl embellishment Perfect for wedding ceremony party Material: Satin, PVC board,faux pearl Color: White  Diameter: Approx. 14cm / 5.5 inch Height with Handle:Approx.21cm / 8.27 inch Height without Handle:Approx.11cm / 4.33 inch Package Includes: 1 x Flower Girl Basket Note: Please be reminded that due to lighting effects and monitor's brightness/contrast settings etc, the color tone of the website's photo and the actual item could be slightly different."
Household,"Trust Basket Carnation Mixed Flowers Seeds (Green) About seeds: Planting seed is an inexpensive way to grow your favorite plants. Growing plants from seed has many good benefits. We will save money, we can choose from varieties far beyond those locally available, we also experience the joy of watching a lifeless seed sprout into a living plant. A seed is a plant embryo, its initial food supply is stored within a protective coating. Seeds remain dormant until a combination of moisture, temperature, air, and light triggers germination. In order to plant the seeds, the potting mixture or soil should be moisten or slightly wet. Plant the seed half or an inch inside the soil. When seeds are first planted, they need an extra bit of water in order to start the germination process. Water the seeds regularly via sprinkler, seeds rely on a constant supply of water to go through the germination process, thereby producing a sprout. Water on a regular basis so that the potting mixture is always moist but never soaking. When your seeds outgrow their containers and are planted outside, they will not need nearly as much water to thrive. It may take few days to few weeks for the seeds begin to push tiny sprouts through the soil. At this point, they should be moved to natural sunlight. Place them where it gets plenty of light throughout the day. It may take several weeks before your plants are ready to be transplanted. Most plants go through a growth phase which makes it easy to know when they are ready to be moved outdoors. The first set of leaves that appear are known as the seed leaves. The second set of leaves to appear are called the true leaves and are a sign that your plants are matured and ready for moving. You can feed the plants with a bit of liquid fertilizer after they have sprouted, to help expedite this growing process."
Household,"Raaya Stylsh Decorative Basket for Carrying Fruits, Chocolates Gift Items, Flowers, 35 Gram, Pack of 1 Fancy Basket Decorative For Home Decor And Living Room, Royal Basket For Wedding And Special Occasions This handcrafted basket from the brand of RAAYA is best for seasonal decorations and to make home look more attractive and give a ancient look. These handcrafted products are made of wire and it comes in Golden colour. Handmade products for home decor as well as daily use purposes with attractive finishing. This Handcrafted basket is best for decoration and makes your dining table look more attractive. Keeps fruits and vegetables conveniently in the kitchen or on the dining table. Can also be used as flower basket. This attractive container can be used for holding household items, or in bakeries and floral shops as well as just about any type of establishment. It is a restaurant quality serving baskets. We can use this to freshly baked bread, candies, crackers, finger foods and snacks house rolls, French fries, crunchy chips and fruit, or use it for holding individually wrapped condiments or napkins. Easily stackable and dishwasher safe, these baskets are perfect for both commercial food service and home use. For enhanced food presentation put a cloth napkin or paper food wrap inside the basket. Light-weight and easy to transport, this basket is an excellent addition to any restaurant or food service establishment. These baskets are perfectly suited for servicing at fine restaurants, outdoor picnics and your dining table."
Household,"Aashi Enterprise Cane Basket roti Serving Gift Multipurpose Flower Fruit Vegetable (38 cm x 38 cm x 41 cm, Brown) This handcrafted basket from the house of Aashi Enterprise is best for seasonal decorations and to make home look more attractive and give a ancient look. These handcrafted products are made of cane and it comes in brown color weighing 0.5 kg and with this dimension 38 cm x 38 cm x 41 cm ."
Household,TrustBasket Oval Planter Set of 2 Ivory color 12*7 inches
Household,"Prime Decorative Metal Basket for Storage and Gifting, 150 Gram, 2 Pcs, Gold & Silver, Pack of 1 Fancy Basket Decorative For Home Decor And Living Room | Royal Basket For Wedding And Special Occasions This handcrafted basket from the brand of Prime is best for seasonal decorations and to make home look more attractive and give a ancient look. These handcrafted products are made of wire and it comes in Golden And silver color. Handmade products for home decor as well as daily use purposes with attractive finishing. This Handcrafted basket is best for decoration and makes your dining table look more attractive. Keeps fruits and vegetables conveniently in the kitchen or on the dining table. Can also be used as flower basket. This attractive container can be used for holding household items, or in bakeries and floral shops as well as just about any type of establishment. It is a restaurant quality serving baskets. We can use this to freshly baked bread, candies, crackers, finger foods and snacks house rolls, French fries, crunchy chips and fruit, or use it for holding individually wrapped condiments or napkins. Easily stackable and dishwasher safe, these baskets are perfect for both commercial food service and home use. For enhanced food presentation put a cloth napkin or paper food wrap inside the basket. Light-weight and easy to transport, this basket is an excellent addition to any restaurant or food service establishment. These baskets are perfectly suited for servicing at fine restaurants, outdoor picnics and your dining table."
Household,"Cottage Furnish Bamboo Flower Basket, 5 X 5 X 3.5 Inches, Beige Basket made from bamboo slivers"
Household,"GiftingBestWishes Small Round Wire Basket with Flower Handles (Metal, 12x10-inches, Multicolour) Small round metal wire decorative gift basket with flower handles. Can be re-used for home decor and storage. Ideal for gifting fruits, dry fruits, chocolates, cookies etc on any special auspicious occasions like Diwali, Rakhi, Holi, birthdays parties, festivals, weddings and more."
Household,"Kabello Plastic Royal Basket (Multicolour) - Set of 1 Color Name:Golden M2   Basket for Home Using | handcrafted Basket for Decorations This handcrafted basket from the brand of Kabello is best for seasonal decorations and to make home look more attractive and give a ancient look. These handcrafted products are made of Plastics wire and it comes in Golden and silver colour .Handmade products for home decor as well as daily use purposes with attractive finishing. This Handcrafted Plastics Wooden basket is best for decoration and makes your dining table look more attractive. Keeps fruits and vegetables conveniently in the kitchen or on the dining table. Can also be used as flower basket. This attractive container can be used for holding household items, or in bakeries and floral shops as well as just about any type of establishment. It is a restaurant serving baskets. We can use this to freshly baked bread , candies , crackers, finger foods and snacks house rolls, French fries, crunchy chips and fruit, or use it for holding individually wrapped condiments or napkins. Easily stackable and dishwasher safe, these baskets are perfect for both commercial food service and home use. For enhanced food presentation put a cloth napkin or paper food wrap inside the basket. Light-weight and easy to transport, this basket is an excellent addition to any restaurant or food service establishment. These baskets are perfectly suited for servicing at fine restaurants, outdoor picnics and your dining table."
Household,"Floralbay Special Basket Arrangement of 15 Mix Roses Fresh Flowers ""love - the most beautiful feeling. Flowera - the most charming creation of god. Combine both these beautiful existences of the world and gift these flowere of love to your only one on the upcoming valentine's day. The flower arrangements of seasonal fillers are incredible. Get these flowers. Book this as your florist today."" this could be your best gift on valentine's day as it is nothing short of being a festival that celebrates the notion of love. Whether you are already drowned in love, or are half way in it, gifts for valentine's day always coming in handy.whenever you want to express your feelings towards someone, sending flowers would be the best way to do it. Flowers convey unsaid words. At times, only words are not sufficient or something you don't find words to convey what you want. Flower contains the magical powers that helps to express your intrinsic feeling in the very subtle manner. Express your feeling with Floralbay large range of floral arrangements / floral gifts which will surely bring a smile on your loved once. Be it any occasion birthday, anniversary, marriage, valentine's day, mother's day, miss you, diwali, father's day. This is the most beautiful way to surprise your love once. the image displayed is indicative in nature. Actual product may vary in shape or design as per the availability. flowers may be delivered in fully bloomed, semi-bloomed or bud stage. the chosen time is an estimate and depends on the availability of the product and the destination to which you want the product to be delivered. since flowers are perishable in nature, we attempt of your order only once. The cannot be redirected to any other address. this product is hand delivered and will not be delivered along with courier products. occasionally, substitution of flowers is necessary due to temporary and/or regional unavailability issues."
Household,"Raunak Seeds Flower Seeds : Petunia Basket Mixed Flower Seeds Kitchen Garden Pack Seeds may treated with Thiram, a fungicide just used for seeds safety to increase seeds dormancy level, not harmful- But not to be used Direct seeds for food, feed, or oil purpose!! Seeds needs to be sown in pots or land direct if seeds are small size needs to sow together later needs to be transplant for big size seeds like okra, gourds, sunflower seeds can sow one by one direct no transplantaion required!! The picture is an indication of type Only!! Our seeds are for gardeners , small garden pack, if you have tried this vty, know the results than only sow direct in field for farming purpose!! House of OP, Imported and Hybrid Seeds!! Please contact customer care via email for any further assistance!! Happy Gardening!!"
Household,"Artificial Silk Rose Petals Decoration Flowers (Red) -100 Pieces These Life Like Petals Are Great To Decorate Tables By Scattering Them Around, Fill The Flower Girls Basket, Accent Tables with Them, Use Around The Cake or Decorate Favors .Package Includes:300Pcs Rose Petals.Taken from Hongkong."
Household,"Pindia Wooden & Wrought Iron Small Miniature Tricycle Flower Rikshaw Vase An Impeccable Decorative Item for Your Home If you look upon yourself as an artistic individual, then it goes without saying that the best place that'll reflect your creative bent of mind would be your home. The Pindia rickshaw flower holder is one such immaculate home decorative item that'll definitely add to the overall grace of your study room or drawing room. You can conveniently place this miniature rickshaw flower holder on the mantelpiece besides the sofa or on top of the bookcase in your living room. Its elegant design and fascinating black colour are sure to attract everyone's attention.Bestowed with Remarkable Features The Pindia flower holder comes equipped with awe-aspiring features. Chiselled from superior grade wrought iron, the mantelpiece exudes elegance and stylishness. The sturdiness of the material imparts an extraordinary durability to the item. Carved out of mango wood, the seat also accentuates the overall look of this decorative product. The circular basket-type opening just behind the seat is spacious enough to take in a bunch of flowers. This flower holder is undoubtedly a collector's item for all those individuals keen to embellish their homes with ornamentation objects. You can buy this decorative flower stand online sitting in the confines of your home.Brand: PindiaDecorative mantelpiece Crafted from wrought iron and mango wood Sturdy and durable Resistant to corrosion Handmade item by Rural Artists of India"
Household,"Pindia Wooden & Wrought Iron Small Miniature Tricycle Flower Rikshaw Vase An Impeccable Decorative Item for Your Home If you look upon yourself as an artistic individual, then it goes without saying that the best place that'll reflect your creative bent of mind would be your home. The Pindia rickshaw flower holder is one such immaculate home decorative item that'll definitely add to the overall grace of your study room or drawing room. You can conveniently place this miniature rickshaw flower holder on the mantelpiece besides the sofa or on top of the bookcase in your living room. Its elegant design and fascinating black colour are sure to attract everyone's attention.Bestowed with Remarkable Features The Pindia flower holder comes equipped with awe-aspiring features. Chiselled from superior grade wrought iron, the mantelpiece exudes elegance and stylishness. The sturdiness of the material imparts an extraordinary durability to the item. Carved out of mango wood, the seat also accentuates the overall look of this decorative product. The circular basket-type opening just behind the seat is spacious enough to take in a bunch of flowers. This flower holder is undoubtedly a collector's item for all those individuals keen to embellish their homes with ornamentation objects. You can buy this decorative flower stand online sitting in the confines of your home.Brand: PindiaDecorative mantelpiece Crafted from wrought iron and mango wood Sturdy and durable Resistant to corrosion Handmade item by Rural Artists of India"
Household,"Mk Stainless Steel Vegetable Steamer, Pasta Steamer, Folding Collapsible Basket - Silver Collapsible for easy storage Removable center post Dishwasher safe a great addition to any kitchen is the stainless steel vegetable steamer basket. this fabulous steamer opens to a 12 inch diameter perfect for steaming a large amount a vegetables at one time. the center spoke is removable and has a ring at the top that makes removing the steamer from the pot easy to do. lightly steamed vegetables are not only healthier for you, they're actually more attractive when you serve them. after you are finished, this steamer collapses for easy storage. a must have in any kitchen. Features: -Can also be used as fruit basket & flower vase -Unique design, Very Useful for steaming Modaks Boil Potatoes & Vegetables cook Steamed Momos. Material: Stainless Steel Color: Silver."
Household,"Nayasa Flower Piece Plastic Laundry Basket, Red Color Name:Red   This laundry basket from the house of nayasa comes in red colour. Laundry basket is a perfect space saver and ideal to use anywhere. Offers comfortable grip and is light weight and has an elegant design. Has air vents to keep clothes odour free and is portable."
Household,"Kabello Plastic Royal Basket (Multicolour) - Set of 1 Color Name:Golden M2   Basket for Home Using | handcrafted Basket for Decorations This handcrafted basket from the brand of Kabello is best for seasonal decorations and to make home look more attractive and give a ancient look. These handcrafted products are made of Plastics wire and it comes in Golden and silver colour .Handmade products for home decor as well as daily use purposes with attractive finishing. This Handcrafted Plastics Wooden basket is best for decoration and makes your dining table look more attractive. Keeps fruits and vegetables conveniently in the kitchen or on the dining table. Can also be used as flower basket. This attractive container can be used for holding household items, or in bakeries and floral shops as well as just about any type of establishment. It is a restaurant serving baskets. We can use this to freshly baked bread , candies , crackers, finger foods and snacks house rolls, French fries, crunchy chips and fruit, or use it for holding individually wrapped condiments or napkins. Easily stackable and dishwasher safe, these baskets are perfect for both commercial food service and home use. For enhanced food presentation put a cloth napkin or paper food wrap inside the basket. Light-weight and easy to transport, this basket is an excellent addition to any restaurant or food service establishment. These baskets are perfectly suited for servicing at fine restaurants, outdoor picnics and your dining table."
Household,"FULLY Steel and Wooden Wire Basket for Fruits (Gold) Color Name:Big Gold   This handcrafted basket from the of FULLY is for seasonal decorations and to make home look more attractive and give a ancient look. These handcrafted products are made of steel wire and it comes in golden and silver color .handmade steel products for home decor as well as daily use purposes with attractive finishing. This handcrafted steel basket is for decoration and makes your dining table look more attractive.keeps fruits and vegetables conveniently in the kitchen or on the dining table. Can also be used as flower basket. This attractive container can be used for holding household items, or in bakeries and floral shops as well as just about any type of establishment. It is a restaurant serving baskets .we can use this to freshly baked bread , candies , crackers, finger foods and snacks house rolls, french fries, crunchy chips and fruit, or use it for holding individually wrapped condiments or napkins. Easily stackable and dishwasher safe, these baskets are perfect for both commercial food service and home use. For enhanced food presentation put a cloth napkin or paper food wrap inside the basket. Light-weight and easy to transport, this basket is an excellent addition to any restaurant or food service establishment.these baskets are perfectly suited for servicing at fine restaurants, outdoor picnics and your dining table."
Household,"Floralbay Special Basket Arrangement of 15 Mix Roses Fresh Flowers ""love - the most beautiful feeling. Flowera - the most charming creation of god. Combine both these beautiful existences of the world and gift these flowere of love to your only one on the upcoming valentine's day. The flower arrangements of seasonal fillers are incredible. Get these flowers. Book this as your florist today."" this could be your best gift on valentine's day as it is nothing short of being a festival that celebrates the notion of love. Whether you are already drowned in love, or are half way in it, gifts for valentine's day always coming in handy.whenever you want to express your feelings towards someone, sending flowers would be the best way to do it. Flowers convey unsaid words. At times, only words are not sufficient or something you don't find words to convey what you want. Flower contains the magical powers that helps to express your intrinsic feeling in the very subtle manner. Express your feeling with Floralbay large range of floral arrangements / floral gifts which will surely bring a smile on your loved once. Be it any occasion birthday, anniversary, marriage, valentine's day, mother's day, miss you, diwali, father's day. This is the most beautiful way to surprise your love once. the image displayed is indicative in nature. Actual product may vary in shape or design as per the availability. flowers may be delivered in fully bloomed, semi-bloomed or bud stage. the chosen time is an estimate and depends on the availability of the product and the destination to which you want the product to be delivered. since flowers are perishable in nature, we attempt of your order only once. The cannot be redirected to any other address. this product is hand delivered and will not be delivered along with courier products. occasionally, substitution of flowers is necessary due to temporary and/or regional unavailability issues."
Household,"Sky Trends Flower Cycle Red White Flower Plastic Basket Cycle With Artificial Flower & Plant Showpiece Gift Set A fantastic gift to say you care, for a Birthday present or Anniversary gift, a special gift that will create a talking point.This eye catching decorative miniature rickshaw fabricated Vase with high quality materials. It is replica of the original rickshaw.These beautiful vase from the house of Sky Trends that will instantly enhance the visual appeal of your room.This is crafted by skilled craftsmen and it is designed for providing elegant and traditional look for home decor."
Household,"Trust basket Single Pot Railing Planter, Set of 5 (Red, Yellow, Blue, Orange, Green) Color Name:Set of 5 - Multicolor    RAILING PLANTERSRailing planters are the best planters to grow plant and to dÃ©cor your garden. Instead of using table top planters you can use railing planters. for example:- if you place these planters on a balcony or in terrace railings/wall this planters will give an appealing look for your house/flat/apartment. Railing planters are not only used to grow plants they also welcome your visitors. Railing Special Planters can be easy to hang on the balcony, window, railing, anywhere in the room to decorate them. It can be used for indoor and outdoor decorations.Trust basket planters are weather resistant and their color doesn't fade in sunlight or water. This planter specially made with galvanized iron which is rust resistant material and these planters have drainage hole in the bottom to flow Excess of water."
Household,"Sky Trends Flower Cycle Red White Flower Plastic Basket Cycle With Artificial Flower & Plant Showpiece Gift Set A fantastic gift to say you care, for a Birthday present or Anniversary gift, a special gift that will create a talking point.This eye catching decorative miniature rickshaw fabricated Vase with high quality materials. It is replica of the original rickshaw.These beautiful vase from the house of Sky Trends that will instantly enhance the visual appeal of your room.This is crafted by skilled craftsmen and it is designed for providing elegant and traditional look for home decor."
Household,"Floralbay Special Basket Arrangement with 21 Fresh Roses (Red) Size:Basket of 21   ""love - the most beautiful feeling. Flowera - the most charming creation of god. Combine both these beautiful existences of the world and gift these flowere of love to your only one on the upcoming valentine's day. The flower arrangements of seasonal fillers are incredible, this could be your best gift on valentine's day as it is nothing short of being a festival that celebrates the notion of love. Whether you are already drowned in love, or are half way in it, gifts for valentine's day always coming in handy.whenever you want to express your feelings towards someone, sending flowers would be the best way to do it. Flowers convey unsaid words. At times, only words are not sufficient or something you don't find words to convey what you want. Flower contains the magical powers that helps to express your intrinsic feeling in the very subtle manner. Express your feeling with Floralbay large range of floral arrangements / floral gifts which will surely bring a smile on your loved once. Be it any occasion birthday, anniversary, marriage, valentine's day, mother's day, miss you, diwali, father's day. This is the most beautiful way to surprise your love once, the image displayed is indicative in nature. Actual product may vary in shape or design as per the availability. flowers may be delivered in fully bloomed, semi-bloomed or bud stage."
